[
  {
    "offering_id": "borealis-demo-foods:ipo:2026",
    "company_id": "borealis-demo-foods",
    "type": "IPO",
    "segment": "MAINBOARD",
    "exchanges": [
      "NSE",
      "BSE"
    ],
    "facts": {
      "fresh_issue": {
        "fact_id": "borealis-demo-foods:fresh_issue:na",
        "metric": "fresh_issue",
        "label": "Fresh issue",
        "value": 350.0,
        "unit": "INR crore",
        "period": null,
        "basis": "offer",
        "kind": "reported",
        "formula": null,
        "inputs": [],
        "source": {
          "source_type": "SAMPLE",
          "document_id": "sample",
          "page": 9,
          "table": null,
          "section": null,
          "url": "sample://demo-document",
          "sha256": null,
          "tier": "primary"
        },
        "extraction": {
          "method": "sample",
          "extracted_at": "2026-10-05T08:00:00+05:30",
          "extractor_version": "sample",
          "confidence": "high"
        },
        "status": "ok",
        "note": null,
        "supersedes": null
      },
      "ofs": {
        "fact_id": "borealis-demo-foods:ofs:na",
        "metric": "ofs",
        "label": "Offer for sale",
        "value": 650.0,
        "unit": "INR crore",
        "period": null,
        "basis": "offer",
        "kind": "reported",
        "formula": null,
        "inputs": [],
        "source": {
          "source_type": "SAMPLE",
          "document_id": "sample",
          "page": 9,
          "table": null,
          "section": null,
          "url": "sample://demo-document",
          "sha256": null,
          "tier": "primary"
        },
        "extraction": {
          "method": "sample",
          "extracted_at": "2026-10-05T08:00:00+05:30",
          "extractor_version": "sample",
          "confidence": "high"
        },
        "status": "ok",
        "note": null,
        "supersedes": null
      },
      "total_issue": {
        "fact_id": "borealis-demo-foods:total_issue:na",
        "metric": "total_issue",
        "label": "Total issue",
        "value": 1000.0,
        "unit": "INR crore",
        "period": null,
        "basis": "offer",
        "kind": "reported",
        "formula": null,
        "inputs": [],
        "source": {
          "source_type": "SAMPLE",
          "document_id": "sample",
          "page": 9,
          "table": null,
          "section": null,
          "url": "sample://demo-document",
          "sha256": null,
          "tier": "primary"
        },
        "extraction": {
          "method": "sample",
          "extracted_at": "2026-10-05T08:00:00+05:30",
          "extractor_version": "sample",
          "confidence": "high"
        },
        "status": "ok",
        "note": null,
        "supersedes": null
      },
      "price_band_low": {
        "fact_id": "borealis-demo-foods:price_band_low:na",
        "metric": "price_band_low",
        "label": "Price band — low",
        "value": 268,
        "unit": "INR",
        "period": null,
        "basis": "offer",
        "kind": "reported",
        "formula": null,
        "inputs": [],
        "source": {
          "source_type": "SAMPLE",
          "document_id": "sample",
          "page": 9,
          "table": null,
          "section": null,
          "url": "sample://demo-document",
          "sha256": null,
          "tier": "primary"
        },
        "extraction": {
          "method": "sample",
          "extracted_at": "2026-10-05T08:00:00+05:30",
          "extractor_version": "sample",
          "confidence": "high"
        },
        "status": "ok",
        "note": null,
        "supersedes": null
      },
      "price_band_high": {
        "fact_id": "borealis-demo-foods:price_band_high:na",
        "metric": "price_band_high",
        "label": "Price band — high",
        "value": 282,
        "unit": "INR",
        "period": null,
        "basis": "offer",
        "kind": "reported",
        "formula": null,
        "inputs": [],
        "source": {
          "source_type": "SAMPLE",
          "document_id": "sample",
          "page": 9,
          "table": null,
          "section": null,
          "url": "sample://demo-document",
          "sha256": null,
          "tier": "primary"
        },
        "extraction": {
          "method": "sample",
          "extracted_at": "2026-10-05T08:00:00+05:30",
          "extractor_version": "sample",
          "confidence": "high"
        },
        "status": "ok",
        "note": null,
        "supersedes": null
      },
      "lot_size": {
        "fact_id": "borealis-demo-foods:lot_size:na",
        "metric": "lot_size",
        "label": "Lot size",
        "value": 53,
        "unit": "shares",
        "period": null,
        "basis": "offer",
        "kind": "reported",
        "formula": null,
        "inputs": [],
        "source": {
          "source_type": "SAMPLE",
          "document_id": "sample",
          "page": 9,
          "table": null,
          "section": null,
          "url": "sample://demo-document",
          "sha256": null,
          "tier": "primary"
        },
        "extraction": {
          "method": "sample",
          "extracted_at": "2026-10-05T08:00:00+05:30",
          "extractor_version": "sample",
          "confidence": "high"
        },
        "status": "ok",
        "note": null,
        "supersedes": null
      },
      "face_value": {
        "fact_id": "borealis-demo-foods:face_value:na",
        "metric": "face_value",
        "label": "Face value",
        "value": 1,
        "unit": "INR",
        "period": null,
        "basis": "offer",
        "kind": "reported",
        "formula": null,
        "inputs": [],
        "source": {
          "source_type": "SAMPLE",
          "document_id": "sample",
          "page": 9,
          "table": null,
          "section": null,
          "url": "sample://demo-document",
          "sha256": null,
          "tier": "primary"
        },
        "extraction": {
          "method": "sample",
          "extracted_at": "2026-10-05T08:00:00+05:30",
          "extractor_version": "sample",
          "confidence": "high"
        },
        "status": "ok",
        "note": null,
        "supersedes": null
      }
    },
    "intermediaries": {
      "brlms": [
        "Demo Capital"
      ],
      "registrar": "Demo Registrar"
    }
  }
]
